{
  "schema": "brunnr-code.review-integration.operation/v1",
  "contract": "brunnr-code.review-integration/v1",
  "operation": "review.validate",
  "result": {
    "schema": "brunnr-code.review-gate-result/v1",
    "result": "allow",
    "allowed": true,
    "action": "repository-policy",
    "reason": "delivery follows ordinary repository policy",
    "context": {"gate": "pre-commit"},
    "delivery": "unmanaged"
  }
}
